{
  "$schema": "http://json-schema.org/draft-07/schema#",
  "title": "EGold Proof-of-Reserve V1",
  "type": "object",
  "additionalProperties": true,
  "required": [
    "schemaVersion",
    "network",
    "chainId",
    "contractAddress",
    "tokenSymbol",
    "tokenDecimals",
    "operationType",
    "operationId",
    "reserveId",
    "proofGeneratedAt",
    "validAfter",
    "validBefore",
    "operator",
    "account",
    "amountUnits",
    "amountGrams",
    "custody",
    "vaultId",
    "custodianName",
    "jurisdiction",
    "bars",
    "totalFineGoldMilligrams",
    "audit",
    "auditReportHash",
    "reserveLedger",
    "previousLedgerRoot",
    "newLedgerRoot",
    "externalReferences"
  ],
  "properties": {
    "schemaVersion": {
      "const": "EGOLD_PROOF_V1"
    },
    "network": {
      "type": "string",
      "minLength": 1
    },
    "chainId": {
      "type": "integer",
      "minimum": 1
    },
    "contractAddress": {
      "type": "string",
      "pattern": "^0x[a-fA-F0-9]{40}$"
    },
    "tokenSymbol": {
      "const": "EGOLD"
    },
    "tokenDecimals": {
      "const": 4
    },
    "operationType": {
      "enum": [
        "MINT",
        "BURN"
      ]
    },
    "operationId": {
      "type": "string",
      "pattern": "^0x[a-fA-F0-9]{64}$"
    },
    "reserveId": {
      "type": "string",
      "pattern": "^0x[a-fA-F0-9]{64}$"
    },
    "proofGeneratedAt": {
      "type": "string",
      "minLength": 1
    },
    "validAfter": {
      "type": "integer",
      "minimum": 0
    },
    "validBefore": {
      "type": "integer",
      "minimum": 1
    },
    "operator": {
      "type": "string",
      "pattern": "^0x[a-fA-F0-9]{40}$"
    },
    "account": {
      "type": "string",
      "pattern": "^0x[a-fA-F0-9]{40}$"
    },
    "amountUnits": {
      "type": "string",
      "pattern": "^[0-9]+$"
    },
    "amountGrams": {
      "type": "string",
      "pattern": "^[0-9]+\\.[0-9]{4}$"
    },
    "custody": {
      "type": "object"
    },
    "vaultId": {
      "type": "string",
      "minLength": 1
    },
    "custodianName": {
      "type": "string",
      "minLength": 1
    },
    "jurisdiction": {
      "type": "string",
      "minLength": 1
    },
    "bars": {
      "type": "array",
      "minItems": 1
    },
    "totalFineGoldMilligrams": {
      "type": "string",
      "pattern": "^[0-9]+$"
    },
    "audit": {
      "type": "object"
    },
    "auditReportHash": {
      "type": "string",
      "pattern": "^0x[a-fA-F0-9]{64}$"
    },
    "reserveLedger": {
      "type": "object"
    },
    "previousLedgerRoot": {
      "type": "string",
      "pattern": "^0x[a-fA-F0-9]{64}$"
    },
    "newLedgerRoot": {
      "type": "string",
      "pattern": "^0x[a-fA-F0-9]{64}$"
    },
    "externalReferences": {
      "type": "array"
    }
  }
}
