{
  "account": "0x2F7548424c958d759976f45AB1b67fa3353Fa42B",
  "amountGrams": "1.0000",
  "amountUnits": "10000",
  "audit": {
    "auditReportHash": "0x90b3f33b5734dc17d80c61b58df6bbaa770ddde91ae884eb4f2d6acf41d1a3e3",
    "auditReportRef": "SMOKE-AUDIT-20260707T181106Z",
    "auditReportUri": "ipfs://egold-smoke-audit-20260707t181106z",
    "auditorName": "Example Reserve Auditor LLP"
  },
  "auditReportHash": "0xf7e0891f9be615d66b7092f5f743f9dcf48c1769cd1656bc6dd78954b47646ce",
  "bars": [
    {
      "barId": "SMOKE-MINT-BAR-20260707T181106Z",
      "barSerialHash": "0x17e06e5184e80383b66377b7bfbf10584d51886eaad139fa0e1ba5e15c16ff34",
      "fineGoldMilligrams": "1000",
      "finenessPpm": 9999,
      "grossMassMilligrams": "1000",
      "refinery": "Example Refinery"
    }
  ],
  "chainId": 11155111,
  "contractAddress": "0x99E3Eb7aFA17eaed346F8F7a4524529049aB5Dd9",
  "custodianName": "Example Independent Vault Ltd",
  "custody": {
    "barSetId": "EGOLD-SMOKE-BARSET-20260707T181106Z",
    "custodianName": "Example Independent Vault Ltd",
    "custodyReceiptRef": "SMOKE-CUSTODY-20260707T181106Z",
    "jurisdiction": "CH-ZG",
    "vaultId": "SEPOLIA-PROOF-LINKED-SMOKE-VAULT"
  },
  "externalReferences": [
    "ipfs://egold-smoke-proof-20260707t181106z",
    "https://example.invalid/egold/smoke/20260707T181106Z"
  ],
  "jurisdiction": "CH-ZG",
  "network": "sepolia",
  "newLedgerRoot": "0x6cb5e8a08244b004583af2972213db7f2862c102a1c277db8e9ae8821f0c3309",
  "operationId": "0xe9396bc6a2411b20d9bfa07caa89fa61373408d02c8cb829cf570589cf865958",
  "operationType": "MINT",
  "operator": "0xAB202fDd7D6Aa4C2c8ee96b184327e8aF635bD59",
  "previousLedgerRoot": "0xa671ec9899cd5c99f8ef8f36c9ce9085499a17371b463df031ee63294bc21edb",
  "proofGeneratedAt": "2026-07-07T18:11:06Z",
  "reserveId": "0x01485f2921b1d7477e8d478dd77a634af64c9bedef51b19ac3fd3259e0c53cb7",
  "reserveLedger": {
    "entryRef": "SMOKE-LEDGER-BURN-20260707T181106Z",
    "entryType": "BURN",
    "ledgerId": "EGOLD-SEPOLIA-PROOF-LINKED-SMOKE",
    "newLedgerRoot": "0xffde132d5032372c3722f3db5b2669c4bc7007444b8b57e6280c97e55f2db4ce",
    "previousLedgerRoot": "0x9a4c97364ab4f8b16412e299e20a8c0eccc335d6559c957d559669e39ef28dba",
    "runRef": "20260707T181106Z"
  },
  "schemaVersion": "EGOLD_PROOF_V1",
  "tokenDecimals": 4,
  "tokenSymbol": "EGOLD",
  "totalFineGoldMilligrams": "1000",
  "validAfter": 1783447806,
  "validBefore": 1783534266,
  "vaultId": "SEPOLIA-PROOF-LINKED-SMOKE-VAULT"
}
