{
  "account": "0x2F7548424c958d759976f45AB1b67fa3353Fa42B",
  "amountGrams": "0.4000",
  "amountUnits": "4000",
  "audit": {
    "auditReportHash": "0x90b3f33b5734dc17d80c61b58df6bbaa770ddde91ae884eb4f2d6acf41d1a3e3",
    "auditReportRef": "SMOKE-AUDIT-20260707T181106Z",
    "auditReportUri": "ipfs://egold-smoke-audit-20260707t181106z",
    "auditorName": "Example Reserve Auditor LLP"
  },
  "auditReportHash": "0x90b3f33b5734dc17d80c61b58df6bbaa770ddde91ae884eb4f2d6acf41d1a3e3",
  "bars": [
    {
      "barId": "SMOKE-BURN-BAR-20260707T181106Z",
      "barSerialHash": "0xbd80678a908cb6a1f4a7efc934e5f735d9a190caebe25b2422af6cd86c81412e",
      "fineGoldMilligrams": "400",
      "finenessPpm": 9999,
      "grossMassMilligrams": "400",
      "refinery": "Example Refinery"
    }
  ],
  "chainId": 11155111,
  "contractAddress": "0x99E3Eb7aFA17eaed346F8F7a4524529049aB5Dd9",
  "custodianName": "Example Independent Vault Ltd",
  "custody": {
    "barSetId": "EGOLD-SMOKE-BARSET-20260707T181106Z",
    "custodianName": "Example Independent Vault Ltd",
    "custodyReceiptRef": "SMOKE-CUSTODY-20260707T181106Z",
    "jurisdiction": "CH-ZG",
    "vaultId": "SEPOLIA-PROOF-LINKED-SMOKE-VAULT"
  },
  "externalReferences": [
    "ipfs://egold-smoke-proof-20260707t181106z",
    "https://example.invalid/egold/smoke/20260707T181106Z"
  ],
  "jurisdiction": "CH-ZG",
  "network": "sepolia",
  "newLedgerRoot": "0xffde132d5032372c3722f3db5b2669c4bc7007444b8b57e6280c97e55f2db4ce",
  "operationId": "0x6b5f69ab483efc91f02afcdbabda48caef32ce8f863208d4ff418c9e91af53ea",
  "operationType": "BURN",
  "operator": "0xAB202fDd7D6Aa4C2c8ee96b184327e8aF635bD59",
  "previousLedgerRoot": "0x9a4c97364ab4f8b16412e299e20a8c0eccc335d6559c957d559669e39ef28dba",
  "proofGeneratedAt": "2026-07-07T18:11:06Z",
  "reserveId": "0x01485f2921b1d7477e8d478dd77a634af64c9bedef51b19ac3fd3259e0c53cb7",
  "reserveLedger": {
    "entryRef": "SMOKE-LEDGER-BURN-20260707T181106Z",
    "entryType": "BURN",
    "ledgerId": "EGOLD-SEPOLIA-PROOF-LINKED-SMOKE",
    "newLedgerRoot": "0xffde132d5032372c3722f3db5b2669c4bc7007444b8b57e6280c97e55f2db4ce",
    "previousLedgerRoot": "0x9a4c97364ab4f8b16412e299e20a8c0eccc335d6559c957d559669e39ef28dba",
    "runRef": "20260707T181106Z"
  },
  "schemaVersion": "EGOLD_PROOF_V1",
  "tokenDecimals": 4,
  "tokenSymbol": "EGOLD",
  "totalFineGoldMilligrams": "400",
  "validAfter": 1783447806,
  "validBefore": 1783534266,
  "vaultId": "SEPOLIA-PROOF-LINKED-SMOKE-VAULT"
}
